Date,Name,Comment
28/09/2020,Juan Anderson,The most advanced Best Name Generator. Generate random names addresses usernames passwords email addresses and more. Use for software testing social media or anything else. <a href="http://fakenamegenerator.com/">Best Name Generator</a>
24/04/2020,Reese Armstrong,YES PLEASE!!!
30/03/2020,James Watsson,This is cool too
30/03/2020,James Watsson,This is awesome. i love the way you shared was so smart way was.
25/07/2019,Guest,The combination of several keys is known as Windows Shortcut Keys. Create Desktop Shortcut Window 10  keys are very important for the user to avoid using the mouse and touchpad.
17/10/2018,Uili Fecteau,This would be great especially if you want more developers taking up webflow. Tiny windows to work in sux.
