Date,Name,Comment
06/07/2020,Sandra Junker,Is that problem fixed? Or is there any workaround to fix that issue?
12/06/2020,Guest,Knowledge is very important for us to know amazing hindi facts and rochak tathya please visit Amazing Hindi Facts you will find amazing knowledge releted to animals space and much more
05/09/2019,Tempie Christlebar,This seems like it would be a no brainer. This would be a huge improvement. Any word on this in the works?
01/05/2019,Park House,Having the same issue
26/02/2019,Bailey Simrell,Definitely need something like this..... Would be handy to go from 4 across to 2 across on tablet with a layout I am working on right now.
