Date,Name,Comment
03/06/2020,Guest,Although AccuRadio is  Download DJ Marathi Songs ad-supported it does offer unlimited skipping of songs—something that most free streaming websites don’t offer. If you like to listen on the go you can use AccuRadio’s mobile apps which are available for Android iOS Marathi DJ Songs Download and many other platforms.
08/05/2020,Guest,It is not hard process to find the open my PCso we here and learn how can do i show this icon where do i find my computer windows 10 this is common window issuenow look it here and use the best way.
28/02/2020,Gary Lutke,The problem is that with all the additional plugin etc is the cost. The running cost of the site will just increase and as certain startups have only a set budget. So hope that the Review will get built in soon : )
03/04/2019,Benjamin Perko,Hey Jason
15/11/2018,Webflow Team,I believe you can already do this by creating a new collection and putting the reviews in there.  If you want to let users add reviews automatically you can make a Zap in Zapier.com:
